{
  "schemaVersion": "1.0",
  "catalogFingerprint": "sha256:3333333333333333333333333333333333333333333333333333333333333333",
  "profiles": [
    {
      "profile": {
        "$schema": "https://openelis-global.org/contracts/analyzer/v1/analyzer-profile.schema.json",
        "schemaVersion": "1.0",
        "profileMeta": {
          "id": "fluorocycler-xt",
          "version": "3.0.0",
          "displayName": "Bruker FluoroCycler XT",
          "confidence": "MEDIUM_HIGH"
        },
        "analyzer_name": "Bruker FluoroCycler XT",
        "manufacturer": "Bruker",
        "model": "FluoroCycler XT",
        "category": "MOLECULAR",
        "protocol": {
          "name": "FILE",
          "format": "XLSX"
        },
        "capabilities": {
          "inboundResults": true,
          "outboundOrders": false,
          "connectionTest": true
        },
        "supported_extensions": [".ods", ".xlsx", ".xls"],
        "column_mapping": {
          "Sample ID": "sampleId",
          "SampleID": "sampleId",
          "Type": "qcTask",
          "Calc. Conc.": "result",
          "CalcConc": "result",
          "Result": "interpretation",
          "Interpretation": "interpretation",
          "TargetName": "testCode",
          "testCode": "testCode",
          "WellPosition": "position"
        },
        "result_value_order": ["result", "interpretation"],
        "default_test_mappings": [
          {
            "test_code": "VIH-1",
            "test_name_hint": "HIV-1 Viral Load",
            "loinc": "20447-9",
            "unit": "copies/mL",
            "result_type": "quantitative"
          }
        ],
        "configDefaults": {
          "fileFormat": "XLSX",
          "filePattern": "*.{ods,ODS,xlsx,XLSX,xls,XLS}",
          "hasHeader": true,
          "sheetIndex": 0
        },
        "connectionFields": [
          {
            "key": "directory",
            "labelKey": "analyzer.connection.field.directory",
            "inputKind": "FILE_PATH",
            "required": true,
            "choices": []
          },
          {
            "key": "filePattern",
            "labelKey": "analyzer.connection.field.filePattern",
            "helpTextKey": "analyzer.connection.field.filePattern.help",
            "inputKind": "TEXT",
            "required": true,
            "choices": []
          }
        ],
        "controlResultRecognition": {
          "mode": "RULES",
          "rules": {
            "positive-control-task": {
              "ruleType": "FIELD_EQUALS",
              "targetField": "QC_TASK",
              "operand": "Positive"
            },
            "negative-control-task": {
              "ruleType": "FIELD_EQUALS",
              "targetField": "QC_TASK",
              "operand": "Negative"
            },
            "standard-control-task": {
              "ruleType": "FIELD_EQUALS",
              "targetField": "QC_TASK",
              "operand": "Standard"
            },
            "positive-control-prefix": {
              "ruleType": "SPECIMEN_ID_PREFIX",
              "operand": "C+"
            },
            "negative-control-prefix": {
              "ruleType": "SPECIMEN_ID_PREFIX",
              "operand": "C-"
            }
          }
        },
        "catalog": {
          "revision": 1,
          "revisionFingerprint": "sha256:a39955225875ee8cc4ae2a5a0c587acd5c9e376749485ef48ef1eca2cefcf770",
          "recognitionFingerprint": "sha256:5c0de42e1135b772b23e4c1ea04b0162b30fe36fc08ecef76a70108ba031be26",
          "source": "SHIPPED",
          "status": "ACTIVE",
          "publishedAt": "2026-08-19T00:00:00Z",
          "publishedBy": "distribution"
        }
      },
      "publication": {
        "action": "SHIPPED",
        "actor": "distribution",
        "markedAt": "2026-08-19T00:00:00Z"
      },
      "controlRecognitionSummary": {
        "recognitionFingerprint": "sha256:5c0de42e1135b772b23e4c1ea04b0162b30fe36fc08ecef76a70108ba031be26",
        "mode": "RULES",
        "description": "Any listed condition identifies a control result.",
        "affirmedNoControlResults": false,
        "conditions": [
          {
            "key": "positive-control-task",
            "kind": "FIELD_VALUE_EQUALS",
            "sourceLabel": "Control task",
            "value": "Positive",
            "description": "Control task equals Positive"
          },
          {
            "key": "negative-control-task",
            "kind": "FIELD_VALUE_EQUALS",
            "sourceLabel": "Control task",
            "value": "Negative",
            "description": "Control task equals Negative"
          },
          {
            "key": "standard-control-task",
            "kind": "FIELD_VALUE_EQUALS",
            "sourceLabel": "Control task",
            "value": "Standard",
            "description": "Control task equals Standard"
          },
          {
            "key": "positive-control-prefix",
            "kind": "SPECIMEN_ID_STARTS_WITH",
            "sourceLabel": "Specimen ID",
            "value": "C+",
            "description": "Specimen ID starts with C+"
          },
          {
            "key": "negative-control-prefix",
            "kind": "SPECIMEN_ID_STARTS_WITH",
            "sourceLabel": "Specimen ID",
            "value": "C-",
            "description": "Specimen ID starts with C-"
          }
        ]
      }
    }
  ],
  "issues": [
    {
      "source": "file [/app/analyzer-profiles/broken.json]",
      "reason": "Cannot load shipped profile: Unexpected character"
    }
  ]
}
